{
  "chapter": {
    "chapter_id": "018f0000-0000-7001-8000-000000000003",
    "current_revision": {
      "blocks": [
        {
          "block_kind": "paragraph",
          "manuscript_block_id": "018f0000-0000-7001-8000-0000000000b1",
          "text": "雨落在窗沿。"
        }
      ],
      "body": "雨落在窗沿。",
      "revision_id": "018f0000-0000-7001-8000-000000000004"
    },
    "title": "第一章"
  },
  "correlation_id": "018f0000-0000-7001-8000-000000000006",
  "project_activity_position": "0",
  "project_scope": {
    "owner_user_id": "018f0000-0000-7001-8000-000000000001",
    "project_id": "018f0000-0000-7001-8000-000000000002"
  },
  "schema_id": "storyos.query.chapter.response.v1"
}
